<Rules_Facts xmlns:xsi="http://www.w3.org/2001/XMLSchema-instance"
             xsi:noNamespaceSchemaLocation="schema.xsd">
    <Rules>
        <Rule>
            <Fact fact="aa"/>
        </Rule>
    </Rules>
    <Facts>
        <Fact>_a3</Fact>
        <Fact>A</Fact>
        <Fact>a3</Fact>
        <Fact>A3</Fact>
        <Fact>Aa3</Fact>
        <Fact>a_3</Fact>
        <Fact>____________________a</Fact>
        <Fact>_________a3</Fact>
        <Fact>Aaaaa3</Fact>
    </Facts>
</Rules_Facts>